{
  "_generated": "tools/contracts/generate-capabilities.mjs",
  "schemaVersion": 1,
  "engineVersion": "0.7.0",
  "capabilities": [
    {
      "id": "feedback.audio-effects",
      "status": "experimental",
      "version": "0.1.0",
      "owner": "presentation-protocol",
      "targets": [
        "browser",
        "electron"
      ],
      "contracts": [
        "contracts/presentation-events.schema.json"
      ],
      "examples": [
        "examples/first-game"
      ],
      "dependencies": [
        "presentation.three",
        "runtime.lua-gameplay"
      ],
      "verification": [
        "pnpm test",
        "pnpm game -- validate --project examples/first-game --format json"
      ],
      "limitations": [
        {
          "code": "AUDIO_NATIVE_BACKEND_UNAVAILABLE",
          "message": "Audio is implemented through Web Audio in BrowserHost and ElectronHost only."
        },
        {
          "code": "EFFECT_GRAPH_UNAVAILABLE",
          "message": "Visual effects currently support bounded particle bursts, not general effect graphs."
        }
      ]
    },
    {
      "id": "host.electron-steam-package",
      "status": "experimental",
      "version": "0.2.0",
      "owner": "hosts/electron",
      "targets": [
        "electron"
      ],
      "contracts": [
        "contracts/desktop-host.schema.json"
      ],
      "examples": [
        "examples/first-game"
      ],
      "dependencies": [
        "runtime.save-replay"
      ],
      "verification": [
        "pnpm test:desktop",
        "pnpm game -- package --project examples/first-game --target steam-macos --format json"
      ],
      "limitations": [
        {
          "code": "DESKTOP_CROSS_PLATFORM_NOT_RUN",
          "message": "Windows and Linux packages still require smoke tests on native runners."
        },
        {
          "code": "DESKTOP_SIGNING_REQUIRES_AUTHORITY",
          "message": "Signing, notarization and store upload require explicit user credentials and authorization."
        }
      ]
    },
    {
      "id": "operability.control-harness",
      "status": "experimental",
      "version": "0.1.0",
      "owner": "cli",
      "targets": [
        "native-headless"
      ],
      "contracts": [
        "contracts/control-protocol.schema.json",
        "schemas/scenario.schema.json",
        "contracts/run-manifest.schema.json",
        "contracts/ui-view-model.schema.json",
        "contracts/rendered-ui-snapshot.schema.json"
      ],
      "examples": [
        "examples/first-game/scenarios/charge-core.jsonc"
      ],
      "dependencies": [
        "runtime.lua-gameplay",
        "runtime.save-replay"
      ],
      "verification": [
        "pnpm test:cli",
        "pnpm test:harness",
        "pnpm test:cold-session"
      ],
      "limitations": [
        {
          "code": "HARNESS_HEADLESS_CAPTURE_IS_SEMANTIC",
          "message": "The headless adapter captures deterministic SVG for composition and semantics; pixel evidence requires game capture --raster, which renders through the ElectronHost."
        },
        {
          "code": "HARNESS_RASTER_REQUIRES_DESKTOP_SESSION",
          "message": "Raster capture needs an installed Electron and a graphical session; headless Linux runners require a virtual display."
        },
        {
          "code": "HARNESS_SHADER_AND_AUDIO_CODES_GENERIC",
          "message": "Host diagnostics report script errors, rejected promises, missing assets and lost WebGL contexts; shader and audio failures still surface under those generic codes."
        },
        {
          "code": "HARNESS_COMMAND_TRACE_DERIVED",
          "message": "Command-stage traces report committed state diffs and do not expose private Lua instructions."
        }
      ]
    },
    {
      "id": "presentation.three",
      "status": "experimental",
      "version": "0.2.0",
      "owner": "renderer-three",
      "targets": [
        "browser",
        "electron"
      ],
      "contracts": [
        "presentation-protocol/src/index.ts"
      ],
      "examples": [
        "examples/first-game",
        "examples/card-roguelite"
      ],
      "dependencies": [],
      "verification": [
        "pnpm --filter @ludivra/renderer-three build",
        "pnpm game -- build --project examples/first-game --target web --format json"
      ],
      "limitations": [
        {
          "code": "PRESENTATION_NATIVE_RENDERER_UNAVAILABLE",
          "message": "The current renderer is Three.js on web technology hosts; native visual hosts are not implemented."
        }
      ]
    },
    {
      "id": "proof.card-roguelite-loop",
      "status": "experimental",
      "version": "0.1.0",
      "owner": "examples/card-roguelite",
      "targets": [
        "native-headless",
        "browser",
        "electron"
      ],
      "contracts": [
        "schemas/game.schema.json",
        "schemas/card-roguelite.schema.json",
        "schemas/scenario.schema.json"
      ],
      "examples": [
        "examples/card-roguelite/content/run.jsonc",
        "examples/card-roguelite/scenarios/run-victory.jsonc"
      ],
      "dependencies": [
        "feedback.audio-effects",
        "operability.control-harness",
        "presentation.three",
        "runtime.content-binding",
        "runtime.lua-gameplay",
        "runtime.save-replay"
      ],
      "verification": [
        "pnpm test:card-roguelite"
      ],
      "limitations": [
        {
          "code": "CARD_FRAMEWORK_NOT_EXTRACTED",
          "message": "The loop is intentionally game-specific until a second game proves a reusable card contract."
        },
        {
          "code": "CARD_VISUAL_BASELINE_SINGLE_PROFILE",
          "message": "Only the desktop 1280x800@2x baseline is approved; other viewports, text scales and device scale factors remain NOT_AVAILABLE."
        }
      ]
    },
    {
      "id": "runtime.content-binding",
      "status": "experimental",
      "version": "0.1.0",
      "owner": "runtime-web",
      "targets": [
        "native-headless",
        "browser",
        "electron"
      ],
      "contracts": [
        "schemas/game.schema.json",
        "schemas/card-roguelite.schema.json"
      ],
      "examples": [
        "examples/card-roguelite/content/run.jsonc"
      ],
      "dependencies": [
        "runtime.lua-gameplay"
      ],
      "verification": [
        "pnpm test:card-roguelite"
      ],
      "limitations": [
        {
          "code": "CONTENT_PACK_NOT_IMPLEMENTED",
          "message": "Validated JSONC is composed into the Lua authoring chunk; the production binary content-pack compiler is not implemented yet."
        },
        {
          "code": "CONTENT_NULL_NOT_SUPPORTED",
          "message": "The experimental Lua content binding rejects JSON null instead of assigning it ambiguous Lua nil semantics."
        }
      ]
    },
    {
      "id": "runtime.lua-gameplay",
      "status": "experimental",
      "version": "0.1.0",
      "owner": "kernel",
      "targets": [
        "native-headless",
        "browser",
        "electron"
      ],
      "contracts": [
        "runtime-c-api/include/ludivra/runtime.h"
      ],
      "examples": [
        "examples/first-game"
      ],
      "dependencies": [],
      "verification": [
        "pnpm test:native",
        "pnpm test:wasm-equivalence"
      ],
      "limitations": [
        {
          "code": "LUA_API_EXPERIMENTAL",
          "message": "The Lua API remains experimental until two materially different games prove its reusable surface."
        }
      ]
    },
    {
      "id": "runtime.save-replay",
      "status": "experimental",
      "version": "0.1.0",
      "owner": "kernel",
      "targets": [
        "native-headless",
        "browser",
        "electron"
      ],
      "contracts": [
        "runtime-c-api/include/ludivra/runtime.h"
      ],
      "examples": [
        "examples/first-game"
      ],
      "dependencies": [
        "runtime.lua-gameplay"
      ],
      "verification": [
        "pnpm test:native",
        "pnpm test:wasm-equivalence",
        "pnpm test:desktop"
      ],
      "limitations": [
        {
          "code": "SAVE_COMPATIBILITY_EXPERIMENTAL",
          "message": "Save and replay compatibility are versioned but have not yet been proven across released engine upgrades."
        }
      ]
    }
  ],
  "platforms": {
    "native-headless": "experimental",
    "browser": "experimental",
    "electron": "experimental",
    "android": "planned",
    "ios": "planned",
    "console-native": "planned"
  }
}
